{
  "schema": "bocg.episode-surface/v1",
  "bocg_release": {
    "tag": "v0.7.0",
    "manifest_sha256": "a301e598be8c7c9e53198bc2ae740057411ea7a1515658dfa3f2f99e43cba4a6",
    "task_concepts_sha256": "3618185e198fa868cd0c3a326e5a4c64e25890767db88ba14bc8354ae32f6855"
  },
  "episode_ref": "ep-000000000001",
  "source_profile_ref": "sp-00000000",
  "touchpoints": [
    {
      "division_key": "prime_brokerage_financing",
      "depth": "terminal_task",
      "mapping_status": "QUALIFIED_MAPPING",
      "function_concept_id": null,
      "task_concept_id": "task_concept:prime_brokerage_financing:c30e1996dfc72038db499b4a",
      "task_reference_id": "task:prime_brokerage_financing:9f90df53a2895a29d80ebfef",
      "control_point_id": null,
      "ruling": {"ruled_at": "2026-09-24", "ruled_by_role": "owner"}
    },
    {
      "division_key": "prime_brokerage_financing",
      "depth": "function_concept",
      "mapping_status": "RATIFIED_MAPPING",
      "function_concept_id": "function_concept:prime_brokerage_financing:6bb96f1c40953527fd0d905c",
      "task_concept_id": null,
      "task_reference_id": null,
      "control_point_id": null,
      "ruling": {"ruled_at": "2026-09-24", "ruled_by_role": "owner"}
    },
    {
      "division_key": "trade_lifecycle_operations",
      "depth": "control_point",
      "mapping_status": "PROPOSED",
      "function_concept_id": null,
      "task_concept_id": null,
      "task_reference_id": null,
      "control_point_id": "cp_otc_confirmation_timeliness",
      "ruling": null
    },
    {
      "division_key": "repo_secfin_collateral",
      "depth": "division",
      "mapping_status": "REJECTED_MAPPING",
      "function_concept_id": null,
      "task_concept_id": null,
      "task_reference_id": null,
      "control_point_id": null,
      "ruling": {"ruled_at": "2026-09-24", "ruled_by_role": "owner"}
    }
  ],
  "evidence_depth": "terminal_task",
  "candidate_depth": "control_point"
}
